{"$id":"RAW_ARTIFACT_MANIFEST_V2.schema.json","$schema":"https://json-schema.org/draft/2020-12/schema","additionalProperties":false,"properties":{"artifact_count":{"const":2},"boundaries":{"additionalProperties":false,"properties":{"actual_site_extraction":{"const":false},"d_canonical_db_write":{"const":false},"merge":{"const":false},"personal_data_promotion":{"const":false},"production":{"const":false},"raw_byte_overwrite":{"const":false},"raw_v1_overwrite":{"const":false},"ready":{"const":false},"secret_storage":{"const":false}},"required":["actual_site_extraction","raw_v1_overwrite","raw_byte_overwrite","personal_data_promotion","secret_storage","d_canonical_db_write","production","ready","merge"],"type":"object"},"created_at_kst":{"type":"string"},"current_remote_head_baseline":{"const":"6dfe697363a69f83797775aa549f34614aa3748a"},"directive_comment":{"const":5196652743},"entries":{"items":{"additionalProperties":false,"properties":{"artifact_native_key":{"type":"string"},"byte_size":{"minimum":1,"type":"integer"},"captured_at":{"const":"2026-08-04T05:22:00+09:00"},"expected_mime_type":{"const":"application/json"},"immutability_status":{"const":"IMMUTABLE_GIT_BLOB_VERIFIED"},"locator":{"additionalProperties":false,"properties":{"blob_sha":{"pattern":"^[0-9a-f]{40}$","type":"string"},"byte_scope":{"const":"EXACT_GIT_BLOB_BYTES"},"fixture_page":{"maximum":2,"minimum":1,"type":"integer"},"path":{"type":"string"},"ref":{"const":"6dfe697363a69f83797775aa549f34614aa3748a"},"repository":{"const":"anbin1900-crypto/source-factory-core"}},"required":["repository","ref","path","blob_sha","byte_scope","fixture_page"],"type":"object"},"metadata_status":{"additionalProperties":false,"properties":{"invented_metadata":{"const":"FORBIDDEN"},"observed_mime_type":{"const":"NOT_OBSERVED"},"official_source_url":{"const":"PENDING_AUTHORITY"},"source_key":{"const":"PENDING_AUTHORITY"}},"required":["source_key","official_source_url","observed_mime_type","invented_metadata"],"type":"object"},"mime_type":{"const":"application/json"},"mime_type_scope":{"const":"FIXTURE_BYTE_VERIFIED"},"observed_fixture_source_url":{"pattern":"^https://fixture\\.invalid/listings\\?page=[12]$","type":"string"},"observed_mime_type":{"const":"NOT_OBSERVED"},"official_source_url":{"const":"PENDING_AUTHORITY"},"personal_data_status":{"const":"NOT_APPLICABLE"},"raw_or_redacted":{"const":"RAW"},"record_count":{"const":2},"redaction_status":{"const":"NOT_APPLICABLE"},"route_template":{"const":"https://fixture.invalid/listings?page={page}"},"route_template_status":{"const":"FIXTURE_VERIFIED_FROM_REQUEST_SUMMARY"},"secret_status":{"const":"NOT_APPLICABLE"},"sha256":{"pattern":"^[0-9a-f]{64}$","type":"string"},"source_key":{"const":"PENDING_AUTHORITY"},"source_receipt_pointer":{"additionalProperties":false,"properties":{"blob_sha":{"const":"f4fdab98c6e20d94be90027893e8a63ab1618e03"},"path":{"type":"string"},"request_summary_blob_sha":{"const":"50d0457a42a72e1b4e1c964ffc65f9e13f61b21d"},"request_summary_path":{"type":"string"}},"required":["path","blob_sha","request_summary_path","request_summary_blob_sha"],"type":"object"},"storage_pointer":{"pattern":"^github://","type":"string"}},"required":["artifact_native_key","source_key","official_source_url","route_template","locator","captured_at","storage_pointer","mime_type","byte_size","sha256","raw_or_redacted","redaction_status","personal_data_status","secret_status","immutability_status","source_receipt_pointer","expected_mime_type","observed_mime_type","metadata_status"],"type":"object"},"maxItems":2,"minItems":2,"type":"array"},"followup_batch_id":{"const":"V2-TO-ABCD-D-GROUP-INTEGRATION-FOLLOWUP-BATCH-V1-20260806-001"},"manifest_id":{"type":"string"},"manifest_mode":{"const":"FIXTURE_BYTE_VERIFIED_D_INTAKE_PREPARATION"},"schema_version":{"const":"RAW_ARTIFACT_MANIFEST_V2"},"task_id":{"const":"RAW_ARTIFACT_MANIFEST_V2"},"total_record_count":{"const":4},"validation_counters":{"additionalProperties":false,"properties":{"HASH_MISMATCH_COUNT":{"const":0},"INVENTED_METADATA_COUNT":{"const":0},"RAW_OVERWRITE_COUNT":{"const":0},"SECRET_VALUE_STORAGE_COUNT":{"const":0},"SIZE_MISMATCH_COUNT":{"const":0},"SOURCE_FIELD_LOSS_COUNT":{"const":0},"UNAUTHORIZED_PERSONAL_DATA_COUNT":{"const":0}},"required":["RAW_OVERWRITE_COUNT","HASH_MISMATCH_COUNT","SIZE_MISMATCH_COUNT","SECRET_VALUE_STORAGE_COUNT","UNAUTHORIZED_PERSONAL_DATA_COUNT","INVENTED_METADATA_COUNT","SOURCE_FIELD_LOSS_COUNT"],"type":"object"}},"required":["schema_version","task_id","followup_batch_id","directive_comment","current_remote_head_baseline","manifest_id","manifest_mode","created_at_kst","entries","artifact_count","total_record_count","validation_counters","boundaries"],"title":"RAW_ARTIFACT_MANIFEST_V2","type":"object"}
