{"artifact_count":2,"boundaries":{"actual_site_extraction":false,"d_canonical_db_write":false,"merge":false,"personal_data_promotion":false,"production":false,"raw_byte_overwrite":false,"raw_v1_overwrite":false,"ready":false,"secret_storage":false},"created_at_kst":"2026-08-06T05:03:00+09:00","current_remote_head_baseline":"6dfe697363a69f83797775aa549f34614aa3748a","directive_comment":5196652743,"entries":[{"artifact_native_key":"raw-001-b8ab938fbc39b3f3","byte_size":254,"captured_at":"2026-08-04T05:22:00+09:00","expected_mime_type":"application/json","immutability_status":"IMMUTABLE_GIT_BLOB_VERIFIED","locator":{"blob_sha":"9d34c7e31534906f6d067214f7ddf31f8262c398","byte_scope":"EXACT_GIT_BLOB_BYTES","fixture_page":1,"path":"yolla-panel-v1/b1-collector-materialization/workers/b4-raw-artifact-intake/raw/raw-001-b8ab938fbc39b3f3.json","ref":"6dfe697363a69f83797775aa549f34614aa3748a","repository":"anbin1900-crypto/source-factory-core"},"metadata_status":{"invented_metadata":"FORBIDDEN","observed_mime_type":"NOT_OBSERVED","official_source_url":"PENDING_AUTHORITY","source_key":"PENDING_AUTHORITY"},"mime_type":"application/json","mime_type_scope":"FIXTURE_BYTE_VERIFIED","observed_fixture_source_url":"https://fixture.invalid/listings?page=1","observed_mime_type":"NOT_OBSERVED","official_source_url":"PENDING_AUTHORITY","personal_data_status":"NOT_APPLICABLE","raw_or_redacted":"RAW","record_count":2,"redaction_status":"NOT_APPLICABLE","route_template":"https://fixture.invalid/listings?page={page}","route_template_status":"FIXTURE_VERIFIED_FROM_REQUEST_SUMMARY","secret_status":"NOT_APPLICABLE","sha256":"b8ab938fbc39b3f3b41f73f3b819a871c9e8416aa269e18278682ae0362338f0","source_key":"PENDING_AUTHORITY","source_receipt_pointer":{"blob_sha":"f4fdab98c6e20d94be90027893e8a63ab1618e03","path":"yolla-panel-v1/b1-collector-materialization/workers/b4-raw-artifact-intake/B4_READBACK_RECEIPT_V1.json","request_summary_blob_sha":"50d0457a42a72e1b4e1c964ffc65f9e13f61b21d","request_summary_path":"yolla-panel-v1/b1-collector-materialization/workers/b4-raw-artifact-intake/REQUEST_SUMMARY_V1.json"},"storage_pointer":"github://anbin1900-crypto/source-factory-core@6dfe697363a69f83797775aa549f34614aa3748a/yolla-panel-v1/b1-collector-materialization/workers/b4-raw-artifact-intake/raw/raw-001-b8ab938fbc39b3f3.json"},{"artifact_native_key":"raw-002-c2bd6c5ae5921e52","byte_size":246,"captured_at":"2026-08-04T05:22:00+09:00","expected_mime_type":"application/json","immutability_status":"IMMUTABLE_GIT_BLOB_VERIFIED","locator":{"blob_sha":"9b51ca590b05383ccf891e6ddb7c18cf56160d36","byte_scope":"EXACT_GIT_BLOB_BYTES","fixture_page":2,"path":"yolla-panel-v1/b1-collector-materialization/workers/b4-raw-artifact-intake/raw/raw-002-c2bd6c5ae5921e52.json","ref":"6dfe697363a69f83797775aa549f34614aa3748a","repository":"anbin1900-crypto/source-factory-core"},"metadata_status":{"invented_metadata":"FORBIDDEN","observed_mime_type":"NOT_OBSERVED","official_source_url":"PENDING_AUTHORITY","source_key":"PENDING_AUTHORITY"},"mime_type":"application/json","mime_type_scope":"FIXTURE_BYTE_VERIFIED","observed_fixture_source_url":"https://fixture.invalid/listings?page=2","observed_mime_type":"NOT_OBSERVED","official_source_url":"PENDING_AUTHORITY","personal_data_status":"NOT_APPLICABLE","raw_or_redacted":"RAW","record_count":2,"redaction_status":"NOT_APPLICABLE","route_template":"https://fixture.invalid/listings?page={page}","route_template_status":"FIXTURE_VERIFIED_FROM_REQUEST_SUMMARY","secret_status":"NOT_APPLICABLE","sha256":"c2bd6c5ae5921e520c35fbc7ebe22baff7926944bc001277b9d95931947ab4d2","source_key":"PENDING_AUTHORITY","source_receipt_pointer":{"blob_sha":"f4fdab98c6e20d94be90027893e8a63ab1618e03","path":"yolla-panel-v1/b1-collector-materialization/workers/b4-raw-artifact-intake/B4_READBACK_RECEIPT_V1.json","request_summary_blob_sha":"50d0457a42a72e1b4e1c964ffc65f9e13f61b21d","request_summary_path":"yolla-panel-v1/b1-collector-materialization/workers/b4-raw-artifact-intake/REQUEST_SUMMARY_V1.json"},"storage_pointer":"github://anbin1900-crypto/source-factory-core@6dfe697363a69f83797775aa549f34614aa3748a/yolla-panel-v1/b1-collector-materialization/workers/b4-raw-artifact-intake/raw/raw-002-c2bd6c5ae5921e52.json"}],"followup_batch_id":"V2-TO-ABCD-D-GROUP-INTEGRATION-FOLLOWUP-BATCH-V1-20260806-001","manifest_id":"fixture-run-001-raw-artifact-manifest-v2","manifest_mode":"FIXTURE_BYTE_VERIFIED_D_INTAKE_PREPARATION","schema_version":"RAW_ARTIFACT_MANIFEST_V2","task_id":"RAW_ARTIFACT_MANIFEST_V2","total_record_count":4,"validation_counters":{"HASH_MISMATCH_COUNT":0,"INVENTED_METADATA_COUNT":0,"RAW_OVERWRITE_COUNT":0,"SECRET_VALUE_STORAGE_COUNT":0,"SIZE_MISMATCH_COUNT":0,"SOURCE_FIELD_LOSS_COUNT":0,"UNAUTHORIZED_PERSONAL_DATA_COUNT":0}}
